{
  "status": "placed",
  "model": "qwen36-27b",
  "placement": "kserve-a5000",
  "readiness": "unknown",
  "estimated_cold_start_s": 150,
  "headers": {
    "x-placement": "kserve-a5000"
  },
  "ttl_seconds": 30,
  "reason": {
    "code": "placed_only_candidate",
    "message": "local-code-standard has exactly one physical candidate in catalog 1.0.0: qwen36-27b on kserve-a5000. Readiness is unknown rather than warm or absent because the router does not probe KServe - waking a scaled-to-zero predictor to observe it would be the thing invariant 7 forbids. Budget for a cold start; the estimate is provisional until 35.7 measures it."
  },
  "alternatives": [],
  "catalog_version": "sha256:fd8c4c31d595c733d81084f8243446302df5fac58c39e6b0f12ed3303150667a"
}
